id,question,answer_0,answer_1,answer_2,answer_3,correct
213,What are the major sources of data that scientists use to create phylogenetic evolutionary tree diagrams in order to understand the evolutionary relationships among animals?,"morphological information, fossil record data, molecular data","development into a fixed body plan","animals that display bilateral symmetry are triploblasts","a. Eumetazoans have specialized tissues and parazoans don’t","morphological information, fossil record data, molecular data"
214,What is the simplest multicellular organism and how does its body structure facilitate the movement of water through it?,"Trichoplax adhaerens and sponges","Parazoa and Eumetazoa","Sponges have a large central cavity called a spongocoel with water entering through pores and exiting via an osculum","Sponges are flagellated and able to swim","Sponges have a large central cavity called a spongocoel with water entering through pores and exiting via an osculum"
215,Which of the following statements about sponges is false?,"Choanocytes have flagella that propel water through the body", "Pinacocytes can transform into any cell type", "Lophocytes secrete collagen", "Porocytes control the flow of water through pores in the sponge body", "Pinacocytes can transform into any cell type"
216,What is the defining cell type for cnidarians?,"choanocyte","cnidocyte","nematocyst","mesohyl","cnidocyte"
217,What is the structure of the gastrovascular cavity in cnidarians?,single opening serving as both mouth and anus for extracellular digestion and circulation,divided into chambers by mesenteries for increased absorption,allows for intracellular digestion and diffusion of nutrients,lack of circulatory system limits body wall thickness and necessitates mesoglea,divided into chambers by mesenteries for increased absorption
218,What unique characteristics do cubozoans possess in terms of their eyes and reproductive strategy?,"image-forming eyes, with a cornea, lens, and retina, located in four clusters between each pair of pedalia; separate sexes with fertilization occurring inside the female" ,"active and effective hunters of small marine animals like worms, arthropods, and fish","develop into a single medusa; may develop inside the female or be released","eyes are located in four clusters between each pair of pedalia; clusters consist of four simple eye spots and two image-forming eyes", "active and effective hunters of small marine animals like worms, arthropods, and fish" 
219,What are the three embryonic tissue layers in flatworms and what do they give rise to?,"epidermal tissues (from ectoderm), the lining of the digestive system (from endoderm), and other internal tissues (from mesoderm)", "the nervous system consists of a pair of lateral nerve cords with transverse connections", "flatworms have a branching gastrovascular cavity rather than a complete digestive system", "flatworms lack a digestive system altogether", "epidermal tissues (from ectoderm), the lining of the digestive system (from endoderm), and other internal tissues (from mesoderm)"
220,What are the unique characteristics of rotifers that set them apart from other microscopic aquatic animals?,"complex pseudocoelomate body, divided into head, trunk, and foot; corona feeding structure; skeletal and visceral muscles; ability to secrete sticky material for adhesion", "filter feeders in freshwater and some saltwater environments", "morphological complexity despite small size", "dioecious reproduction with some species exhibiting haplodiploidy", "complex pseudocoelomate body, divided into head, trunk, and foot; corona feeding structure; skeletal and visceral muscles; ability to secrete sticky material for adhesion"
221,Which of the following animals lacks eyes, tentacles, and nephridia, and possesses calcareous spicules embedded in a cuticle for protection?,"Caudofoveata","Solenogastres","Monoplacophora","Polyplacophora","Caudofoveata"
222,What unique characteristic of bivalves allows them to secrete a calcareous nacre or “mother of pearl” around foreign particles that enter the mantle cavity, known for being commercially exploited to produce pearls?,"They possess the unique ability to secrete and deposit a calcareous nacre or “mother of pearl” around foreign particles","They have a coiled shell","They have a foot that is modified for crawling","They have a well-defined head with tentacles and eyes","They possess the unique ability to secrete and deposit a calcareous nacre or “mother of pearl” around foreign particles"
223,What is the function of the siphuncle in shell-bearing Nautilus?,to regulate buoyancy,to regulate gas and water in the chambers,to regulate the amount of nitrogen, carbon dioxide, and oxygen mixture,to regulate the amount of water in the shell,"to regulate the amount of water and gases (nitrogen, carbon dioxide, and oxygen mixture) present in the chambers"
224,What is an example of a nematode with a complete digestive system and a protective armor made of collagen and chitin?,Caenorhabditis elegans,Parasitic nematodes,Free-living nematodes,Flatworms,Caenorhabditis elegans
225,What enables Caenorhabditis elegans to be used as a model system for studying developmental and genetic mechanisms?,"It has a short life cycle of just three days, contains about 1,000 cells, and has a genome of only 20,000 genes","It is found in soil and can be easily cultured in a laboratory on agar plates","It has transparent body allowing easy observation of changes within the animal","It has five pairs of autosomes and a pair of sex chromosomes making it ideal for genetic studies","It has a short life cycle of just three days, contains about 1,000 cells, and has a genome of only 20,000 genes"
226,What are the characteristic features of arthropods that distinguish them from other organisms?,"They have jointed appendages, body segmentation, and a chitinous exoskeleton","They have a central cavity called the hemocoel","They have a dorsal brain connected to a ventral nerve cord","They have specialized circulatory structures to move blood", "They have jointed appendages, body segmentation, and a chitinous exoskeleton"
227,What is the characteristic morphology of representative animals from the subphylum Chelicerata?,"They have a body divided into two tagmata: prosoma and opisthosoma, chelicerae, and pedipalps with some species having ovigers","They have a distinct head tagma and antennae for sensory functions","They have a fused head and thorax forming a cephalothorax with biramous appendages","They have an open circulatory system with hemocyanin as the major respiratory pigment","They have a body divided into two tagmata: prosoma and opisthosoma, chelicerae, and pedipalps with some species having ovigers"
228,Which superphylum includes both echinoderms and chordates? ,Protostomia,Deuterostomia,Eumetazoa,Bilateria,Deuterostomia
229,What is the defining characteristic of echinoderms in terms of symmetry and anatomy?,"They exhibit pentaradial symmetry and have an endoskeleton made of calcareous ossicles","They have exoskeletons made of chitin","They have bilateral symmetry and endoskeletons made of cartilage","They have radial symmetry and endoskeletons made of calcium carbonate","They exhibit pentaradial symmetry and have an endoskeleton made of calcareous ossicles"
230,What phylum do sea stars, sea urchins, and sea cucumbers belong to?,"Porifera","Cnidaria","Echinodermata","Chordata","Echinodermata"
231,Which of the following statements about the anatomy of a mollusk is false?,"Mollusks have a radula for grinding food","A digestive gland is connected to the stomach","The tissue beneath the shell is called the mantle","The digestive system includes a gizzard, a stomach, a digestive gland, and the intestine","Mollusks have a radula for grinding food"
232,What are the two major phyla of deuterostomes, including members such as sea stars, sea urchins, and sea cucumbers?,"Echinodermata","Chordata","Protostomes","Cnidaria","Chordata"
233,Which subphylum of chordates includes organisms that have a bony, cartilaginous, or fibrous structure surrounding the brain, jaw, and facial bones?,"Cephalochordata","Urochordata","Vertebrata (Craniata)","Myxini","Vertebrata (Craniata)"
234,What distinguishes vertebrates from invertebrate chordates in terms of skeletal structure?,"presence of a vertebral column composed of vertebrae","presence of a cartilaginous skull","presence of a fibrous and cartilaginous skeleton","presence of a notochord that eventually becomes the nucleus pulposus of intervertebral discs","presence of a vertebral column composed of vertebrae"
235,What is the largest class of vertebrates in existence today?,"Chondrichthyes","Osteichthyes","Placoderm","Acanthodians","Osteichthyes"
236,What are the three clades of modern amphibians?,"Urodela (“tailed”), Anura (“tail-less”), Apoda (“legless ones”)","Salientia, newts, Labyrinthodontia,","Amphibia, Lissamphibia, Gymnophiona","Caecilia","Urodela (“tailed”), Anura (“tail-less”), Apoda (“legless ones”)".
237,What is the order to which salamanders belong?,"Urodela (or Caudata)","Anura","Apoda","Anura"
238,Which of the following is a characteristic of reptiles that distinguishes them from amphibians?,"They usually lay eggs on land","They have moist skin for respiration","They have four limbs","They reproduce asexually","They usually lay eggs on land"
239,What group of reptiles includes species with elevated thoracic temperatures and may be considered regional endotherms?,"Squamata","Crocodilia","Testudines","Sphenodontia","Crocodilia"
240,What are the anatomical differences between Pleurodira and Cryptodira turtles?,"Pleurodira retract their neck with a horizontal curve, Cryptodira retract their neck in a vertical S-curve","Turtles have a bony or cartilaginous shell incorporated into the skeletal system","Turtles are oviparous, laying their eggs on land","None of the above","Pleurodira retract their neck with a horizontal curve, Cryptodira retract their neck in a vertical S-curve"
241,What are some of the characteristics of birds that facilitate flight?,"endothermic and homeothermic, feathers for insulation and flight, wings with primary and secondary feathers for thrust and lift, flexible flight feathers for reduced drag", "high metabolic rate due to active flight, endothermic and homeothermic like mammals, two main types of feathers - contour and down feathers", "flexible flight feathers for lift and thrust, primary feathers at wing tip and secondary feathers closer to body for thrust and lift", "skeletal modifications like fusion of clavicles, deep sternum with keel, keel-shaped projection for muscle attachment", "endothermic and homeothermic, feathers for insulation, wings with primary and secondary feathers for thrust and lift"
242,What is one of the unique features that birds typically have in terms of their neck and tail structure?,"elongate S-shaped neck and a short tail or pygostyle produced from the fusion of caudal vertebrae","closed circulatory system with two atria and two ventricles","epidermis without sweat glands","columella in the middle ear", "elongate S-shaped neck and a short tail or pygostyle produced from the fusion of caudal vertebrae"
243,What are some characteristics unique to mammals that are essential for their survival?,hair provides insulation, sensory functions, and protective coloration,secretory glands in integument provide sebum and sweat,mammary glands produce milk,endothermic nature helps retain heat,evolutionarily derived from synapsids,lower jaw consists of only one bone, specific jaw hinge connects to skull.,.
244,What characteristic distinguishes synapsids from many other vertebrates in terms of body temperature regulation?,"endothermy","ectothermy","exothermy","mesothermy","endothermy"
245,What adaptations do all primate species possess for climbing trees?,"a rotating shoulder joint, a big toe widely separated from the other toes (except humans), thumbs separated from fingers for gripping branches, and stereoscopic vision" ,"brains larger than most other mammals, flattened nails, typically only one offspring per pregnancy, trend toward holding the body upright" ,"claws modified into flattened nails, rotating hip joint, binocular vision, large ears","elongated limbs, webbed feet, nocturnal habits","a rotating shoulder joint, a big toe widely separated from the other toes (except humans), thumbs separated from fingers for gripping branches, and stereoscopic vision"
246,What is the evolutionary relationship between Hominins and modern humans according to Figure 29.46?,"Ardipithecus is the youngest with a bipedality confirmed, Sahelanthropus is the oldest with uncertain human ancestor status, Orrorin is similar to modern humans despite being older",
"It is not thought at this time that Sahelanthropus tchadensis was an ancestor of modern humans", "Orrorin tugenensis is a relatively recent discovery from 6 MYA", "Modern humans evolved from a common ancestor shared with Australopithecus about 2 million years ago", "Modern humans evolved from a common ancestor shared with Australopithecus about 2 million years ago"
247,What are the two clades of invertebrate chordates mentioned in the text?,Urochordata (tunicates) and Cephalochordata (lancelets),Cephalochordata (lancelets) and Vertebrata (Craniata),Urochordata (tunicates) and Vertebrata (Craniata),Urochordata (tunicates) and Hagfishes (agnathan jawless fishes),Urochordata (tunicates) and Cephalochordata (lancelets)
248,Which group of invertebrates is most closely related to vertebrates?,"cephalochordates","echinoderms","arthropods","urochordates","cephalochordates"
249,Which plant tissue is responsible for continuous cell division and growth in the tips of stems and roots?,"Meristematic tissue","Permanent tissue","Dermal tissue","Vascular tissue","Meristematic tissue"
250,Which tissue enables a monocot leaf blade to increase in length from the leaf base?,"dermal, vascular, and ground tissue","introduction of annual rings","parenchyma, collenchyma, and sclerenchyma cells","meristems","meristems"
251,What are the three types of cells present in xylem tissue?,"xylem parenchyma, tracheids, vessel elements","sieve-tube cells, companion cells, phloem parenchyma","collenchyma, sclerenchyma, parenchyma","xylem fibers, sieve elements, companion cells","xylem parenchyma, tracheids, vessel elements"
252,What are two types of root systems seen in seed plants?,"tap root system, fibrous root system","tendrils, 
thorns","root cap, zone of cell division, zone of elongation, zone of maturation","photosynthesis, respiration","tap root system, 
fibrous root system"
253,What is the term used to describe the arrangement of leaves on a stem?,"alternate, spiral, opposite, whorled","alternate, spiral, opposite, whorled","alternate, spiral, opposite, whorled","alternate, spiral, opposite, whorled","alternate, spiral, opposite, whorled"
254,What is the relationship between solute concentration and solute potential in plant cells?,"Solute potential is related to the solute concentration, and is negative in a plant cell and zero in distilled water","Solute potential is related to the pressure potential in plant cells","Solute potential is positive in a plant cell and negative in distilled water","Solute potential is zero in a plant cell and in distilled water","Solute potential is related to the solute concentration, and is negative in a plant cell and zero in distilled water"
255,Which of the following statements is false?,"Negative water potential draws water into the root hairs. Cohesion and adhesion draw water up the xylem. Transpiration draws water from the leaf.",
"Negative water potential draws water into the root hairs. Cohesion and adhesion draw water up the phloem. Transpiration draws water from the leaf.",
"Water potential decreases from the roots to the top of the plant.",
"Water enters the plants through root hairs and exits through stoma.",
"Negative water potential draws water into the root hairs. Cohesion and adhesion draw water up the phloem. Transpiration draws water from the leaf."
256,How do xerophytes and epiphytes reduce transpiration?,by having a thick covering of trichomes or sunken stomata,
by having multiple epidermal layers, by secreting oils and substances through trichomes, by having a thick covering of trichomes or sunken stomata, by having multiple epidermal layers
257,What is the physiological response induced by red light exposure in plants?,conversion to the active Pfr form,conversion 
back to the Pr form,inhibition of phytochrome activity,induction of growth,conversion to the active Pfr form
258,What is the plant hormone responsible for fruit ripening, leaf abscission, and promotion of lateral bud formation?,"auxins","cytokinins","gibberellins","abscisic acid","ethylene"
259,What is ethylene associated with in plants?,"fruit ripening, flower wilting, and leaf fall", "promotion of starch to sugars conversion","preventing fruit ripening","inducing leaf drop", "fruit ripening, flower wilting, and leaf fall"
260,What plant hormone stimulates shoot elongation, seed germination, and the maturation and dropping of fruit and flowers?,gibberellin (GA),ground tissue,guard cells,lateral meristem,gibberellin (GA)
261,Which plant hormone is responsible for inducing dormancy in seeds and buds, and protecting plants from excessive water loss?,"Abscisic acid","Auxins","Cytokinins","Gibberellins","Abscisic acid"
262,What are the nutritional requirements of plants for proper growth and development?,"Carbon (C), Hydrogen (H), Oxygen (O), Nitrogen (N), Phosphorus (P), Potassium (K), Calcium (Ca), Magnesium (Mg), Sulfur (S)","Iron (Fe), Manganese (Mn), Boron (B), Copper (Cu), Zinc (Zn), Nickel (Ni), Chlorine (Cl), Molybdenum (Mo), Cobalt (Co), Sodium (Na), Silicon (Si)","Manganese (Mn), Iron (Fe), Zinc (Zn), Copper (Cu), Carbon (C), Oxygen (O), Nitrogen (N), Potassium (K)", "Hydrogen (H), Oxygen (O), Molybdenum (Mo), Phosphorus (P), Sodium (Na), Calcium (Ca), Sulfur (S), Cobalt (Co)","Carbon (C), Hydrogen (H), Oxygen (O), Nitrogen (N), Phosphorus (P), Potassium (K), Calcium (Ca), Magnesium (Mg), Sulfur (S)"
263,How are soils formed and what are the major components of soil composition?,"inorganic mineral matter, organic matter, water and air","living organisms, climate, topography","parent material, climate, topography, biological factors, and time","bedrock, agriculture, vegetation", "parent material, climate, topography, biological factors, and time"
264,What are some ways in which plants obtain their nutrients?,"through photosynthesis in the presence of sunlight and by forming mutualistic symbiotic relationships with bacteria and fungi","by absorbing nutrients from dead matter and by parasitizing other plants","by converting atmospheric nitrogen into ammonia and by using enzymes to absorb minerals from the soil","through biological nitrogen fixation and by forming specialized structures with legume plants","through biological nitrogen fixation and by forming specialized structures with legume plants"
265,What type of plant obtains food from dead matter and does not have chlorophyll?,"saprophyte","insectivorous plant","epiphyte","symbiont","saprophyte"
266,What is the term for the symbiotic association between fungi and cyanobacteria?,"a. lichen","b. mycorrhizae","c. epiphyte","d. nitrogen-fixing nodule","a. lichen"
267,What are the two distinct phases of female gametophyte development in plants?,"megaspore mother cells undergo meiosis to produce four megaspores, one survives; surviving megaspore undergoes mitosis to form eight-nucleate, seven-cell female gametophyte" "female gametophytes have two distinct phases: a single cell undergoes meiosis to produce four megaspores, one survives; surviving megaspore undergoes mitosis to form eight-nucleate, seven-cell female gametophyte" "female gametophytes undergo meiosis to produce four megaspores, one survives; surviving megaspore undergoes mitosis to form eight-nucleate, seven-cell female gametophyte" "female gametophytes have two distinct phases: a single cell undergoes mitosis to produce eight megaspores, one survives; surviving megaspore undergoes meiosis to form four-nucleate, seven-cell female gametophyte" "female gametophytes have two distinct phases: a single cell undergoes meiosis to produce four megaspores, one survives; surviving megaspore undergoes mitosis to form eight-nucleate, seven-cell female gametophyte"
268,How does pollination differ between angiosperms and gymnosperms?,"Angiosperms involve placement or transfer of pollen from anther to stigma, Gymnosperms involve transfer of pollen from male cone to female cone", "Angiosperms involve self-pollination and cross-pollination, Gymnosperms involve self-pollination", "Angiosperms involve pollen germination to form a pollen tube and sperm for fertilizing the egg, Gymnosperms involve pollen transfer only", "Angiosperms involve artificial selection in plant breeding, Gymnosperms involve natural selection","Angiosperms involve placement or transfer of pollen from anther to stigma, Gymnosperms involve transfer of pollen from male cone to female cone"
269,What type of pollination is characterized by flowers that are green, small, unscented, and produce large amounts of pollen?,"pollination by wind","pollination by water","pollination by insects","pollination by deception","pollination by wind"
270,What are the differences in food reserve storage and seed germination between monocots and dicots?,"the scutellum in monocots is an absorptive organ connected to the endosperm, while dicots have cotyledons acting as absorptive organs","monocots have endospermic seeds with food reserves stored in the large endosperm, while dicots have endospermic seeds with food reserves stored in the endosperm","enzymes are secreted by the aleurone in monocot seeds to degrade stored nutrients, while in dicot seeds the food reserves are quickly moved to developing cotyledons for storage","monocots have the plumule, radicle, and hypocotyl as parts of the embryonic axis, while dicots have the plumule, radicle, and hypocotyl as parts of the embryo","the scutellum in monocots is an absorptive organ connected to the endosperm, while dicots have cotyledons acting as absorptive organs"
271,How can seeds be dispersed in plants?,"by wind, water, animals, and humans","by self-dispersal mechanisms, wind, water, animals, and humans","by attached structures, aerodynamic shape, and buoyant fruit","by weightless structures, appendages, and parachute-like structures", "by wind, water, animals, and humans"
272,What is the difference between plant life span and plant life cycle?,"the length of time from the beginning of development to the death of a plant","the sequence of stages a plant goes through from seed germination to seed production of the mature plant","the sequence of stages a plant goes through from seed germination to seed production of the mature plant","the length of time from the beginning of development to the death of a plant","the sequence of stages a plant goes through from seed germination to seed production of the mature plant"
273,What are the different types of body symmetry exhibited by animals?,asymmetrical,radiosymmetry,bilateral symmetry,dorsal symmetry,bilateral symmetry
274,What are the three types of animal body symmetry and what are examples of animals that exhibit each type?,"asymmetrical (sponge), radial (aquatic animals), bilateral (goat)", "symmetrical (fish), round (earthworm), oblique (mollusks)", "asymmetrical (parrot), radial (starfish), bilateral (human)", "round (jellyfish), radial (sea anemone), bilateral (dog)", "asymmetrical (sponge), radial (aquatic animals), bilateral (goat)"
275,What type of epithelial tissue would be found in the digestive tract for absorbing material and preparing it for entry into the body?,"squamous","cuboidal","columnar","transitional","columnar"
278,What are the two types of glial cells mentioned in the information provided?,astrocytes,oligodendrocytes,microglia,ependymal cells,astrocytes
279,What are the two major groups of animals based on how they maintain body temperature?,Endotherms and Ectotherms,Animals and Plants,Mammals and Birds,Polar bears and seals,Endotherms and Ectotherms
280,Which type of epithelial cell is best adapted to aid diffusion?,"squamous","cuboidal","columnar","transitional","squamous"
281,What are the primary food sources for herbivores, carnivores, and omnivores?,"plant-based food, animal flesh, both plant and animal food","non-plant food, plant-based food, animal flesh","fruit-eaters, meat-eaters, leaf-eaters","nectar feeders, seed eaters, frugivores"
282,Which chamber of the avian stomach contains digestive juices that breakdown food?,"crop","proventriculus","gizzard","cloaca","proventriculus"
284,Which mineral is needed for muscle and neuron function, heart health, blood cell synthesis, and nerve function?,"calcium","chlorine","copper","iron","calcium"
285,Which mineral acts as a cofactor for three essential enzymes in humans: sulfite oxidase, xanthine oxidase, and aldehyde oxidase?,Manganese,Zinc,Selenium,Phosphorus,Selenium
287,What triggers the intestinal phase of digestion and controls the rate of gastric emptying?,"chyme entering the small intestine", "presence of proteins in the stomach", "release of gastrin by G cells in the stomach", "all of the above","all of the above"
288,Which of the following organisms lacks a true brain and instead has a system of separate but connected nerve cells (neurons) called a "nerve net"?,"a sea sponge","a jellyfish","a sea star","a flatworm of the phylum Platyhelminthes","a jellyfish"
