id,question,answer_0,answer_1,answer_2,answer_3,correct
22,What are some examples of polysaccharides and what are their functions in plants and animals?,starch,glycogen,cellulose,chitin,all of the above
23,What is the chemical structure of a triacylglycerol and how many water molecules are released during ester bond formation?,may be similar or dissimilar,"saturated or unsaturated","triglycerides","animal or plant origin",may be similar or dissimilar
24,What are the four levels of protein structure?,primary,secondary,tertiary,quaternary,primary
25,What is the unique sequence in a polypeptide chain known as?,"primary structure","secondary structure","tertiary structure","quaternary structure","primary structure"
26,What are the two main types of nucleic acids and their functions?,"deoxyribonucleic acid (DNA) and ribonucleic acid (RNA), DNA carries genetic information and RNA is involved in protein synthesis","DNA carries genetic information and RNA is involved in protein synthesis","DNA is in the nucleus and RNA leaves the nucleus","DNA forms chromatin with histone proteins and RNA regulates gene expression","DNA carries genetic information and RNA is involved in protein synthesis"
27,What type of carbohydrate serves as the storage form of glucose in animals?,monosaccharides,disaccharides,polysaccharides,cellulose,glycogen
28, What is the smallest unit of a living thing?,"a cell","a tissue","an organ","an organism","a cell"
29,What are the four common components shared by all cells?,"a plasma membrane, cytoplasm, DNA, ribosomes","a nucleus, cytoplasm, RNA, golgi apparatus","mitochondria, endoplasmic reticulum, lysosomes, vacuoles","cell wall, central vacuole, chloroplasts, nucleus","a plasma membrane, cytoplasm, DNA, ribosomes"
30,What is the function of the peptidoglycan cell wall in prokaryotes?,"acts as an extra layer of protection, helps maintain shape, prevents dehydration","enables the cell to attach to surfaces in its environment","enables locomotion","exchanges genetic material during conjugation","acts as an extra layer of protection, helps maintain shape, prevents dehydration"
31,What structures are found in the nucleus and what are their functions?,chromatin (DNA plus proteins) - stores DNA, nucleoplasm - semi-solid fluid inside the nucleus, nucleolus - where ribosome synthesis occurs, nuclear envelope - boundary of the nucleus, nuclear pores - control passage of ions, molecules, and RNA between nucleoplasm and cytoplasm.
32,What is the function of the central vacuole in plant cells?,"regulates the cell’s concentration of water in changing environmental conditions","plays a key role in the cell’s expansion","stores calcium ions in muscle cells","supports the cell's expansion","regulates the cell’s concentration of water in changing environmental conditions"
33,What are the three types of protein fibers present in the cytoskeleton of a cell?,"microfilaments, intermediate filaments, microtubules","microtubules, intermediate filaments, actin filaments","actin filaments, keratin filaments, microtubules","keratin filaments, microfilaments, actin filaments","microfilaments, intermediate filaments, microtubules"
34,What type of structures enable transport of materials from cell to cell in plant tissues?,"Plasmodesmata","Tight Junctions","Desmosomes","Gap Junctions","Plasmodesmata"
35,What are the similarities and differences between gap junctions in animal cells and plasmodesmata in plant cells?,they are both channels between adjacent cells that allow for transporting ions, nutrients, and other substances that enable cells to communicate,they differ structurally, with gap junctions being protein-lined pores formed by connexins in animal cells, while plasmodesmata are channels in plant cells that connect the cytoplasm of adjacent cells,,gap junctions in animal cells,plasmodesmata in plant cells,they differ structurally, with gap junctions being protein-lined pores formed by connexins in animal cells
36,What are the key components of desmosomes?,"cadherins, intermediate filaments,",'actin', 'microfilaments', 'microtubules",c. intermediate filaments
37,Why are plasma membranes arranged as a bilayer rather than a monolayer?,"to form a barrier that separates the cell's interior from the external environment","to allow for flexibility and shape changes in cells","to exhibit a fluid mosaic model structure with amphiphilic molecules","to interact with water and other polar molecules","to form a barrier that separates the cell's interior from the external environment"
38,What is the purpose of carbohydrates in the plasma membrane?,"to allow cells to recognize each other","to maintain fluidity in the membrane","to prevent lower temperatures from inhibiting fluidity","to serve as enzymes","to allow cells to recognize each other"
39,What variations in peripheral proteins and carbohydrates are of prime interest in immunology?,"substances that affect a cell’s recognition sites",
"substances that do not affect a cell’s recognition sites",
"substances that do not pass through the plasma membrane",
"substances that prevent cells from recognizing pathogens","substances that affect a cell’s recognition sites"
40,What is the process by which water moves through a semipermeable membrane according to its concentration gradient?,"facilitated transport","osmosis","filtration","diffusion","osmosis"
41,What process describes the movement of water down its concentration gradient through a cell membrane?,"osmosis",
"diffusion","active transport","facilitated diffusion","osmosis"
42,Why is injecting a potassium solution into a person's blood lethal?,"it creates an imbalance in sodium and potassium levels in living cells","it creates an electrochemical gradient","it moves substances against a concentration gradient","it causes a buildup of high-energy hydrogen ions in mitochondria","it creates an imbalance in sodium and potassium levels in living cells"
43,Which process involves a cell engulfing large particles such as microorganisms through the use of clathrin-coated vesicles?,"Pinocytosis","Endocytosis","Exocytosis","Receptor-mediated endocytosis","Endocytosis"
44,What is the main force driving movement in diffusion?,"temperature","particle size","concentration gradient","membrane surface area","concentration gradient"
45,Which molecule is considered the primary energy currency of all cells?,"ATP","Glucose","Carbon dioxide","Water","ATP"
46,What is the currency used by cells to perform immediate work?,"ATP molecules","Sugar","Glucose","Starch","ATP molecules"
47,What term is used to describe the energy stored within chemical bonds that releases when those bonds break?,"potential energy","kinetic energy","free energy","activation energy","chemical energy"
48,What is the role of activation energy in chemical reactions?,"it is the energy required for all chemical reactions to occur","it is the energy released during a chemical reaction","it determines the rate at which a reaction will proceed","it is the energy stored within ATP molecules","it is the energy required for all chemical reactions to occur"
49,How does the second law of thermodynamics relate to the concept of entropy?,"energy is lost in unusable forms during energy transfers, increasing disorder and randomness within a system","entropy measures the randomness or disorder within a system","entropy means high disorder and low energy","entropy increases as chemical reactions reach equilibrium","entropy measures the randomness or disorder within a system"
50,How many sodium ions could one ATP molecule's hydrolysis move if it takes 2.1 kcal/mol of energy to move one Na+ across the membrane?,"A) 3, B) 4, C) 5, D) 6",A) 3
51,How can enzymes be regulated to either promote or reduce their activity?,"by molecules that inhibit or promote enzyme function, through competitive or noncompetitive inhibition, and through allosteric regulation", "by binding to the active site or allosteric site", "by changing the enzyme's affinity for its substrate", "by binding to other specific non-protein helper molecules", "by molecules that inhibit or promote enzyme function, through competitive or noncompetitive inhibition, and through allosteric regulation"
52,What is the term for the process that changes a substance's natural properties?,"denature","chemical energy","coenzyme","allosteric inhibition","denature"
53,Which vitamin derivative functions as an electron carrier in living systems?
nicotinamide adenine dinucleotide (NAD),riboflavin,thiamine,folate,nicotinamide adenine dinucleotide (NAD)
54,What compound is often called the "energy currency" of the cell and functions similarly to a rechargeable battery?,"adenosine triphosphate (ATP)","NAD+","FAD+","NADP","adenosine triphosphate (ATP)"
55,What is the overall result in terms of molecules produced during the chemical breakdown of glucose by glycolysis?,"Two molecules of a three-carbon sugar called pyruvate","Four ATP molecules and two NADH molecules produced","Two ATP molecules in the phosphorylation of glucose","An isomerase converts glucose-6-phosphate into its isomer fructose-6-phosphate","Four ATP molecules and two NADH molecules produced"
56,What are the three steps involved in the conversion of pyruvate to acetyl CoA?,"removing a carboxyl group from pyruvate and releasing carbon dioxide, oxidizing the hydroxyethyl group to an acetyl group and producing NADH, transferring the enzyme-bound acetyl group to CoA", "changing pyruvate to acetyl CoA","forming citrate from oxaloacetate and acetyl group","converting pyruvic acid to acetyl CoA","removing a carboxyl group from pyruvate and releasing carbon dioxide, oxidizing the hydroxyethyl group to an acetyl group and producing NADH"
57,What is the final electron acceptor in the electron transport chain?,"molecular oxygen","FMN","ubiquinone B","cytochrome c","molecular oxygen"
58,What type of fermentation process results in the production of ethanol?,lactic acid fermentation,alcohol fermentation,anaerobic cellular respiration,pyruvic acid decarboxylation,alcohol fermentation
59,What are the key lipids connected to the glucose pathway and their respective functions?,"cholesterol contributes to cell membrane 
flexibility and is a precursor of steroid hormones, triglycerides are a form of long-term energy storage in animals",
"fat-soluble vitamins essential for cellular function","types of carbohydrates used for energy production","cholesterol contributes to cell 
membrane flexibility and is a precursor of steroid hormones"
60,What would happen to the activity of pyruvate kinase if the levels of fructose-1,6-bisphosphate increase?,"decrease","increase","no change","undetermined","increase"
61,Which metabolic process in all organisms requires energy and can be traced back to photosynthesis?,"a. Cellular respiration","b. Glycolysis","c. Fermentation","d. Anaerobic respiration","a. Cellular respiration"
62,What are the substrates and products of photosynthesis?,"specific wavelengths of visible sunlight, carbon dioxide, and water as substrates","oxygen and glyceraldehyde-3-phosphate (G3P) as products","high energy simple carbohydrate molecules","energy-storing carbohydrates","specific wavelengths of visible sunlight, carbon dioxide, and water as substrates"
63,What ultimately connects to every meal and food a person consumes?,"photosynthesis","dairy","bread","meats","photosynthesis"
64,What instrument can differentiate which wavelengths of light a substance can absorb in photosynthetic organisms?
a. Spectrophotometer
b. Chromatography
c. Microscope
d. Centrifuge
65,Which of the following statements is true about the Calvin Cycle?
a. In photosynthesis, oxygen, carbon dioxide, ATP, and NADPH are reactants. G3P and water are products.
b. In photosynthesis, chlorophyll, water, and carbon dioxide are reactants. G3P and oxygen are products.
c. In photosynthesis, water, carbon dioxide, ATP, and NADPH are reactants. RuBP and oxygen are products.
d. In photosynthesis, water and carbon dioxide are reactants. G3P and oxygen are products.,In photosynthesis, water and carbon dioxide are reactants. G3P and oxygen are products.
66,Which pigments in the light-dependent reactions of photosynthesis are responsible for absorbing energy from sunlight?,"chlorophyll a and accessory pigment chlorophyll b","chlorophyll a and carotenoids","chlorophyll a and chlorophyll b","chlorophyll a and accessory pigment chlorophyll b","chlorophyll a and accessory pigment chlorophyll b"
67,,Which type of chemical signaling acts on nearby cells?,"endocrine signaling","direct signaling", "autocrine signaling", "paracrine signaling","paracrine signaling"
68,How are paracrine signals different from endocrine signals and autocrine signals?,"They act locally between cells that are close together and move by diffusion through the extracellular matrix, They produce a quick response that lasts a short period of time, They elicit a longer-lasting effect and have a slower response, They are produced by signaling cells that can also bind to the ligand released","They act locally between cells that are close together and move by diffusion through the extracellular matrix"
69,How do viruses recognize their host cells?,"by binding to cell-surface receptors on the host cell","by invading a living cell and taking over the hosts cellular apparatus","by reproducing rapidly with small amounts of DNA or RNA","by undergoing random changes in viral proteins","by binding to cell-surface receptors on the host cell"
70,What are the important members of small hydrophobic ligands that can directly diffuse through the plasma membrane and interact with internal receptors?,"steroid hormones, thyroid hormones, and vitamin D","insulin, glucagon, and growth hormone","estrogen, testosterone, and cholesterol","adrenaline, melatonin, and oxytocin","steroid hormones, thyroid hormones, and vitamin D"
71,What lipid can be converted into second messengers and is located near membrane-bound receptors in the plasma membrane?,"Phosphatidylinositol (PI), Phosphatidylcholine (PC), Phosphatidylserine (PS), Phosphatidylethanolamine (PE)", "Phosphatidylcholine (PC)", "Phosphatidylserine (PS)", "Phosphatidylethanolamine (PE)","Phosphatidylinositol (PI)"
72,How do budding yeasts communicate with each other during a process similar to sexual reproduction?,they secrete a signaling molecule called mating factor,they bind to cell-surface receptors in nearby yeast cells,they initiate a cell signaling cascade,they stop their normal growth cycles and initiate a cell signaling cascade,they stop their normal growth cycles and initiate a cell signaling cascade
73,What are the major components of cellular communication in single-celled organisms?,"kinases, second messengers, signaling pathways, ligands","apoptosis, neurotransmitters, growth factors, phosphorylation","chemical synapse, extracellular domain, G-proteins, ligands","autocrine signaling, endocrine signaling, paracrine signaling, direct signaling across gap junctions","kinases, second messengers, signaling pathways, ligands"
74,Which of the following statements about quorum sensing is false?,"Autoinducer must bind to receptor to turn on transcription of genes responsible for the production of more autoinducer","The receptor stays in the bacterial cell, but the autoinducer diffuses out","Autoinducer can only act on a different cell: it cannot act on the cell in which it is made","Autoinducer turns on genes that enable the bacteria to form a biofilm","Autoinducer can only act on a different cell: it cannot act on the cell in which it is made"
75,What is the best approach to prevent bacterial colonization of medical implants?,Increase antibiotic dosing,Create implants with rougher surfaces,Vaccinate patients against all pathogenic bacteria,Inhibit quorum sensing,Inhibit quorum sensing
76,Which of the following is the correct order of events in mitosis?,"Sister chromatids line up at the metaphase plate. The kinetochore becomes attached to the mitotic spindle. The nucleus reforms and the cell divides. Cohesin proteins break down and the sister chromatids separate.","The kinetochore becomes attached to the mitotic spindle. Cohesin proteins break down and the sister chromatids separate. Sister chromatids line up at the metaphase plate. The nucleus reforms and the cell divides.","The kinetochore becomes attached to the cohesin proteins. Sister chromatids line up at the metaphase plate. The kinetochore breaks down and the sister chromatids separate. The nucleus reforms and the cell divides.","The kinetochore becomes attached to the mitotic spindle. Sister chromatids line up at the metaphase plate. Cohesin proteins break down and the sister chromatids separate. The nucleus reforms and the cell divides.","The kinetochore becomes attached to the mitotic spindle. Sister chromatids line up at the metaphase plate. Cohesin proteins break down and the sister chromatids separate. The nucleus reforms and the cell divides."
77,What is the function of a contractile ring composed of actin filaments in animal cells during cytokinesis?,"pulling the equator of the cell inward", "forming a fissure", "cleaving the membrane in two", "all of the above","all of the above"
78,What are the two groups of intracellular molecules that regulate the cell cycle, and what are their roles in the progression of the cell through the checkpoints?,cyclins and cyclin-dependent kinases (Cdks),positive regulation,negative regulation,non-functioning regulator,positive regulation
79,Why are Rb, p53, and p21 referred to as negative regulatory molecules in the cell cycle?,"they stop the cell cycle","they cause the cell cycle to progress","they regulate the cell size","they monitor DNA and supply of oxygen","they stop the cell cycle"
80,What is the process through which prokaryotic cells produce daughter cells?,"binary fission", "karyokinesis", "cytokinesis", "mitosis", "binary fission"
81,What is the structure that is composed of a short length of DNA wrapped around a core of histone proteins on a chromosome?,chromatin,nucleosome,locus,histone,nucleosome
82,28. Compare and contrast a human somatic cell to a human gamete.,"a human somatic cell is diploid, containing two sets of chromosomes, while a human gamete is haploid, containing one set of chromosomes","a human somatic cell is a body cell, such as a skin cell or muscle cell, while a human gamete is a reproductive cell, such as a sperm or egg cell","a human somatic cell undergoes mitosis to produce identical diploid daughter cells, while a human gamete undergoes meiosis to produce genetically unique haploid daughter cells","a human somatic cell is not involved in sexual reproduction, while a human gamete is directly involved in sexual reproduction", "a human somatic cell is diploid, containing two sets of chromosomes, while a human gamete is haploid, containing one set of chromosomes"
83,What is the purpose of meiosis in sexual reproduction?,"to reduce the number of chromosome sets by half, producing haploid cells","to create genetically identical daughter cells","to increase the number of chromosome sets by half","to produce diploid cells","to reduce the number of chromosome sets by half, producing haploid cells"
84,How many unique genetically distinct gametes can be produced from a human cell in meiosis?,"two possible arrangements at the metaphase plate; the possible number of alignments therefore equals 2n in a diploid cell, where n is the number of chromosomes per haploid set","four possible genetic combinations","over eight million possible combinations","eight million","over eight million possible combinations"
85,What are the main differences between mitosis and meiosis?,they occur in meiosis I, homologous chromosomes physically meet and are bound together with the synaptonemal complex, chromosomes develop chiasmata and undergo crossover between nonsister chromatids, chromosomes line up along the metaphase plate as tetrads with kinetochore fibers from opposite spindle poles attached, they are reduced from two sets to one set of chromosomes during meiosis I,they are reduced from two sets to one set of chromosomes during meiosis I
86,What type of life cycle do fungi and algae employ, where the haploid cells that make up the tissues of the dominant multicellular stage are formed by mitosis?,"alternation of generations","diploid-dominant","haploid-dominant","alternation of generations","haploid-dominant"
87,What are the fundamental principles of heredity uncovered by Johann Gregor Mendel through his experiments with garden peas?,"the basic functional units of heredity are genes, genes are carried on chromosomes, genes have the capability to be replicated, expressed, or mutated","Mendel's experiments serve as an excellent starting point for thinking about inheritance","genes are transmitted from parents to offspring according to Mendelian genetics", "the success of Mendel's work is due to his selection of a simple biological system and methodical, quantitative analyses", "the basic functional units of heredity are genes, genes are carried on chromosomes, genes have the capability to be replicated, expressed, or mutated"
88,What ratios did Mendel observe in his garden pea hybridizations for flower color, plant height, seed texture, seed color, pea pod texture, and pea pod color?,"3.15:1,2.84:1,2.96:1,3.01:1,2.95:1,2.82:1", "100 percent violet, 100 percent tall, 100 percent round, 100 percent yellow, 100 percent inflated, 100 percent green", "705 violet, 787 tall, 5,474 round, 6,022 yellow, 882 inflated, 428 green", "224 white, 277 dwarf, 1,850 wrinkled, 2,001 green, 299 constricted, 152 yellow", "705 violet,787 tall, 5,474 round, 6,022 yellow, 882 inflated, 428 green"
89,What did Mendel conclude about the characteristics of plants based on his experiments?,"expressed and latent traits, dominant and recessive traits","characteristics are inherited unchanged in a hybridization, recessive traits become latent in offspring","the traits remain separate in plants of the F1 generation","plants possess two copies of the trait for a characteristic, each parent transmits one copy to offspring","expressed and latent traits, dominant and recessive traits"
90,What technique is used to determine whether an organism expressing a dominant trait is a homozygote or a heterozygote?,"a test cross", "a monohybrid cross", "diploid organisms", "Mendel's hybridization experiments","a test cross"
91,What are the genotypes of the individuals labeled 1, 2, and 3?,"A?, A?, Aa","AA, A?, A?", "A?, A?, aa", "AA, Aa, A?", "A?, A?, Aa"
92,What is the relationship between sex chromosomes and X-linked traits in humans and Drosophila?,"They determine the sex of the individual, how X-linked traits are inherited, and the differences between males and females in expressing these traits","They carry genes that are not present on autosomes, how X-linked traits are inherited, and how reciprocal crosses do not produce the same offspring ratios","They lead to the expression of recessive traits in males, how X-linked traits are inherited, and the difference between wild-type and mutant eye colors","They result in carriers for X-linked disorders, how X-linked traits are inherited, and the difference between homozygous and heterozygous individuals","They determine the sex of the individual, how X-linked traits are inherited, and the differences between males and females in expressing these traits"
93,What method is preferred for more complex crosses involving more than two genes, such as a trihybrid cross involving AABBCC and aabbcc parents?,"the forked-line method","the Punnett-square method","the dihybrid method","the probability method","the forked-line method"
94,What is the probability of offspring being quadruply homozygous recessive for a tetrahybrid cross with individuals heterozygous for all four genes?,"1/256","1/64","1/128","1/32","1/256"
95,What will be the offspring of a dihybrid cross?,"9 tall/inflated:3 tall/constricted:3 dwarf/inflated:1 dwarf/constricted",
"15 triangular:1 ovoid","12 white:3 yellow:1 green","9 agouti:3 solid color:4 albino","9 tall/inflated:3 tall/constricted:3 
dwarf/inflated:1 dwarf/constricted"
96,What is the term for the hypothetical inheritance pattern in which parental traits are blended together in the offspring to produce an intermediate physical appearance?,blending theory of inheritance,continuous variation,discontinuous variation,discontinuous variation,blending theory of inheritance
97,What is the chromosomal theory of inheritance and how does it explain genetic linkage?,"it proposes that genes are located on chromosomes and are inherited as a unit","it explains how different genes are inherited together due to their physical proximity on the same chromosome","it describes the behavior of chromosomes during meiosis","it details how alterations in chromosome structure can lead to genetic disorders","it proposes that genes are located on chromosomes and are inherited as a unit"
98,What did Alfred Sturtevant create in 1913 to represent gene order and relative distance on a chromosome?,a genetic map,a pedigree chart,a punnett square,a chromosome image,a genetic map
99,What is the significance of recombination frequency in genetic mapping?,It correlates with the genetic distance between two alleles,Can determine the likelihood of crossovers between genes on the same chromosome,Indicates whether genes are linked or far apart,All of the above,All of the above
100,What is the most common type of structural rearrangement in chromosomes that can lead to the production of aneuploid gametes?,Chromosomal duplications,Chromosomal deletions,Chromosomal inversions,Chromosomal translocations,Chromosomal inversions
