id,question,answer_0,answer_1,answer_2,answer_3,correct
1,What are the themes and concepts of Biology according to the Biology 2e textbook authors?,The Science of Biology,Atoms, Isotopes, Ions, and Molecules: The Building Blocks,Water,Themes and Concepts of Biology
2,What is the process by which gene expression is regulated in eukaryotic cells?,"The Genetic Code","Prokaryotic Transcription","Eukaryotic Transcription","RNA Processing in Eukaryotes","Regulation of Gene Expression"
3,Which chapter in the Biology 2e textbook covers the topic of the Musculoskeletal System?,"CHAPTER 38","CHAPTER 39","CHAPTER 40","CHAPTER 41","CHAPTER 38"
4,What is the focus of Unit 3 in the biology textbook?,The structures, functions, and processes of the most
basic unit of life: the cell","The earliest experiments that revealed the
basis of genetics through the intricacies of DNA","The core concepts of
evolution with examples illustrating evolutionary processes","The diversity of life with detailed study of various organisms",The earliest experiments that revealed the basis of genetics through the intricacies of DNA
5,Who is the contributor of the General Content Lead at East Mississippi Community College?,"Robert Wise (Plant Biology), University of Wisconsin Oshkosh,Connie Rye (General Content Lead), East Mississippi Community College,Contributing Authors and Reviewers Julie Adams, Aurora University", "Summer Allen, Brown University", "James Bader, Case Western Reserve University", "David Bailey, St. Norbert College", "Connie Rye (General Content Lead), East Mississippi Community College"
6,What is the main difference between inductive reasoning and deductive reasoning?,"Inductive reasoning uses related observations to arrive at a general conclusion, Deductive reasoning uses a general principle or law to forecast specific results, Inductive reasoning is common in descriptive science, Deductive reasoning is used in hypothesis-based science", "Inductive reasoning uses related observations to arrive at a general conclusion"
7,What types of reasoning are used by scientists to advance scientific knowledge: inductive or deductive?,"inductive","deductive","inductive","inductive","inductive"
8,What are the key characteristics or functions that define life in organisms?,order, sensitivity or response to the environment, reproduction, adaptation, growth and development, regulation/homeostasis, energy processing, and evolution,order
9,Which diagram summarizes the evolutionary relationships among biological species based on similarities and differences in genetic or physical traits or both?,"A","B","C","D","A"
10,What are the different branches and subdisciplines of biology that biologists may pursue?,"molecular biology and biochemistry","microbiology","neurobiology","paleontology","molecular biology and biochemistry"
11,What are the fundamental components of living matter?,carbon, hydrogen, nitrogen, oxygen, sulfur, phosphorus,"sodium, potassium, copper, iron","carbon, oxygen, nitrogen, sulfur","carbon, hydrogen, oxygen, nitrogen, iron","carbon, hydrogen, nitrogen, oxygen, sulfur"
12,How many stable isotopes does carbon have and what are their respective mass numbers?,"carbon-12, mass number: 12","carbon-13, mass number: 13","carbon-14, mass number: 14","carbon-12, mass number: 12","carbon-13, mass number: 13"
13,What are the main features of the periodic table?,"groups elements according to atomic number and shared chemical and physical properties","organizes elements based on atomic mass and name","shows each elements atomic mass and atomic number","groups elements based on electron configuration and valence shell","groups elements according to atomic number and shared chemical and physical properties"
14,What orbital is always filled first with electrons in an atom, and how many electrons can it hold?,1s,2s,3s,4s,1s1
15,What types of bonds are stronger and more common in living organisms compared to ionic bonds?,"Ionic and covalent bonds",
"Polar and nonpolar bonds","Van Der Waals interactions","Hydrogen bonds","Covalent bonds"
16,Why do scientists spend time looking for water on other planets?,"to understand its importance to life","to investigate the properties of water on other planets","to determine if water is present on other planets","to explore the unique properties of water", "to understand its importance to life"
17,How do cohesive and adhesive forces help transport water in plants?,"by creating a ""pull"" on the water column","by allowing water molecules to stay connected and pulled along","by increasing the surface tension and creating droplets","by creating a dome-like shape above the rim of the glass", "by allowing water molecules to stay connected and pulled along"
18,Which of the following statements is false?,"Molecules with the formulas CH3CH2COOH and C3H6O2 could be structural isomers",
"Molecules must have a double bond to be cis-trans isomers","To be enantiomers, a molecule must have at least three different atoms or groups connected to a central carbon",
"To be enantiomers, a molecule must have at least four different atoms or groups connected to a central carbon",
"Molecules must have a double bond to be cis-trans isomers"
19,What are functional groups and how do they contribute to the chemical properties of macromolecules?,"groups of atoms that confer specific chemical properties to molecules, attached to carbon backbones, contribute to differing chemical properties of macromolecules, participate in specific chemical reactions", "substituted hydrocarbons are molecules with other elements in their carbon backbone", "functional groups are usually attached to carbon backbones at different places", "functional groups play important roles in DNA, proteins, carbohydrates, and lipids", "groups of atoms that confer specific chemical properties to molecules, attached to carbon backbones, contribute to differing chemical properties of macromolecules, participate in specific chemical reactions"
20,What type of reaction involves combining monomers to form polymers, while releasing water molecules as byproducts?,"dehydration synthesis","hydrolysis","covalent bonding","dehydration synthesis"
21,What are the three subtypes of carbohydrates based on their structure?,"Monosaccharides, Disaccharides, Polysaccharides","Simple sugars, Single sugars, Multiple sugars","Amino acids, Fatty acids, Nucleic acids","Carbon, Hydrogen, Oxygen","Monosaccharides, Disaccharides, Polysaccharides"
22,What are the primary examples of polysaccharides mentioned in the text?,"starch, glycogen, cellulose, and chitin","plants store starch in the form of sugars","plants can synthesize glucose and store excess glucose as starch","enzymes break down starch in humans","starch, glycogen, cellulose, and chitin"
23,What is the chemical structure of a triacylglycerol and how do saturated and unsaturated fats differ?,They are formed from three fatty acids attached to a glycerol backbone, with three water molecules released during ester bond formation. Saturated fats have only single bonds between carbons in the hydrocarbon chain and are saturated with hydrogen, while unsaturated fats have at least one double bond.,They are formed from three fatty acids attached to a glycerol backbone, with three water molecules released during ester bond formation,Saturated fats have only single bonds between carbons in the hydrocarbon chain and are saturated with hydrogen,Unsaturated fats have at least one double bond,Saturated fats have only single bonds between carbons in the hydrocarbon chain and are saturated with hydrogen
24,What are the four levels of protein organization?,primary,secondary,tertiary,quaternary,primary
25,What causes sickle cell anemia at the molecular level?,"A single amino acid substitution in the hemoglobin β chain", "A change in temperature, pH, or exposure to chemicals","Denaturation of the protein structure","A change in nucleotide sequence of the gene’s coding region","A single amino acid substitution in the hemoglobin β chain"
26,What are the two main types of nucleic acids and their functions in living organisms?,DNA and RNA,Carries genetic information;Involved in protein synthesis
27,What type of lipid is comprised of four fused hydrocarbon rings forming a planar structure?,wax,lipid,steroid,phospholipid,steroid
28,What is the smallest unit of a living thing called?,"cell","organism","molecule","atom","cell"
29,What are the basic building blocks of all organisms?,"cells","tissues","organs","organ systems","cells"
30,What advantages might small cell size confer on a cell? What advantages might large cell size have?,"small size allows ions and organic molecules to quickly diffuse, while large size may have more surface area for specialized functions","small size allows waste to quickly diffuse, while large size may have more volume to house organelles","small size allows for rapid cell division, while large size may have more room for genetic material","small size allows for efficient intracellular transport, while large size may have more cellular volume","small size allows ions and organic molecules to quickly diffuse, while large size may have more surface area for specialized functions"
31,What is the function of the nuclear envelope in a cell?,"controlling the passage of ions, molecules, and RNA between the nucleoplasm and cytoplasm","acting as a double-membrane structure in the nucleus","storing chromatin in the nucleoplasm","forming a boundary for the nucleus","acting as a double-membrane structure in the nucleus"
32,What is the name of the specialized smooth endoplasmic reticulum in muscle cells responsible for storing calcium ions?,"sarcoplasmic reticulum","Golgi apparatus","central vacuole","lysosomes","sarcoplasmic reticulum"
33,What are the three types of protein fibers in the cytoskeleton?,microfilaments,intermediate filaments,microtubules,microfilaments
34,What type of communication junction allows materials to pass from one plant cell's cytoplasm to an adjacent cell's cytoplasm?,"Tight Junctions","Plasmodesmata","Desmosomes","Gap Junctions","Plasmodesmata"
35,What is the function of gap junctions in animal cells?,"channel between two adjacent animal cells that allows ions, nutrients, and low molecular weight substances to pass between cells, enabling the cells to communicate","rigid cell covering comprised of various molecules that protects the cell, provides structural support, and gives shape to the cell","large plant cell organelle that regulates the cell’s storage compartment, holds water, and plays a significant role in cell growth as the site of macromolecule degradation","structure within the nucleus that comprises chromatin that contains DNA, the hereditary material","channel between two adjacent animal cells that allows ions, nutrients, and low molecular weight substances to pass between cells, enabling the cells to communicate"
36,Which of the following organelles has the function of hydrolyzing fatty acids, amino acids, and some toxins?,"vacuoles","lysosomes","centrosome","chloroplasts","lysosomes"
37,What is the fluid mosaic model of plasma membrane structure and why are plasma membranes arranged as a bilayer instead of a monolayer,phospholipids,proteins,cholesterol,carbohydrates,proteins
38,What major component of plasma membranes is responsible for allowing cells to recognize each other?,Proteins,Carbohydrates,Lipids,Cholesterol,Carbohydrates
39,What is the role of immunologists in research and healthcare?,studying and developing vaccines,treating allergies, studying autoimmune diseases,treating organ transplantation patients,studies the effects of natural immunity on cancer,studying and developing vaccines
40,How do changes in cellular density affect diffusion rates within the cytoplasm?,"Decrease in cytoplasmic diffusion rate due 
to higher density of cytoplasm","Increase in diffusion rate due to lower cytoplasmic density","Solubility plays a role in diffusion",
"Surface area and plasma membrane thickness affect diffusion rate","Decrease in cytoplasmic diffusion rate due to higher density 
of cytoplasm"
41,What are the three terms used to relate a cell's osmolarity to the extracellular fluid's osmolarity that contains the cells?,hypotonic, isotonic, and hypertonic,"hypotonic, isotonic, and hypertonic", "isotonic, hypotonic, and hyperosmotic", "hypertonic, hypotonic, and hypoosmotic", "hypotonic, isotonic, and hypertonic"
42,How do cells move particles, such as large molecules, parts of cells, and even whole cells, into the cell through a process known as endocytosis?,"by forming a pocket around the target particle on the plasma membrane, which then pinches off to create an intracellular vesicle""by creating a concentration gradient of ions and molecules","through passive diffusion of particles across the membrane","by releasing ATP into the cell","by forming a pocket around the target particle on the plasma membrane, which then pinches off to create an intracellular vesicle"
43,What is the process by which a cell takes in large particles, such as other cells or relatively large particles, known as?,"phagocytosis","pinocytosis","potocytosis","receptor-mediated endocytosis","phagocytosis"
44,What is the primary force driving movement in diffusion?,"temperature","particle size","concentration gradient","membrane surface area","concentration gradient"
45,Which molecule serves as the primary energy currency of all cells?,"ATP","Glucose","CO2","H2O","ATP"
46,What type of metabolic pathway requires an input of energy to synthesize complex molecules from simpler ones?,"anabolic pathways","catabolic pathways","reaction pathways","chemical pathways","anabolic pathways"
47,What type of potential energy is stored within chemical bonds and released when those bonds break, providing living cells with energy from food?,Structural potential energy,Chemical energy,Kinetic energy,Free energy,Chemical energy
48,What is activation energy and why do chemical reactions require it to proceed?,"heat energy from the surroundings, speed up molecule motion, increase frequency and force of collisions, move atoms and bonds within the molecule","ionizing radiation from the sun, electromagnetic radiation from the surroundings","acceleration due to gravity, motion of the molecule","chemical bonds that are already breaking in the molecule", "heat energy from the surroundings, speed up molecule motion, increase frequency and force of collisions, move atoms and bonds within the molecule"
49,What molecule is considered the primary energy currency in cells and is responsible for powering energy-requiring cellular reactions?,adenosine triphosphate (ATP),adenosine monophosphate (AMP),guanosine triphosphate (GTP),cytidine diphosphate (CDP),adenosine triphosphate (ATP)
50,How many sodium ions could one ATP molecule's hydrolysis move if it takes 2.1 kcal/mol of energy to move one Na+ across the membrane?,"0","1","2","3","1"
51,How can enzyme activity be either promoted or reduced through regulation?,by competitive inhibition,by noncompetitive inhibition,by allosteric inhibition,by allosteric activation,by competitive inhibition
52,What is the term for the energy necessary for reactions to occur, and the enzyme's specific region to which the substrate binds?,"activation energy,active site,allosteric inhibition,anabolic","active site"
53,Which of the following is true regarding the function of electron carriers in living systems?,"They bind and carry high-energy electrons between compounds in biochemical pathways","They are derived from the B vitamin group","They can be easily reduced or oxidized","They provide an incremental way for cells to transfer and use energy","They bind and carry high-energy electrons between compounds in biochemical pathways"
54,What compound is often referred to as the "energy currency" of the cell and functions similarly to a rechargeable battery?,"adenosine triphosphate (ATP)","adenosine diphosphate (ADP)","ribose","adenine"
55,What is the overall result in terms of molecules produced during the chemical breakdown of glucose by glycolysis?,"two molecules of a three-carbon sugar called pyruvate",
"eight ATP molecules and four NADH molecules produced","the process does not use oxygen directly","the second half of glycolysis",
"two molecules of a three-carbon sugar called pyruvate"
56,What is the process by which pyruvate, the product of glycolysis, undergoes three steps to enter the next pathway?,Step 1: A carboxyl group is removed from pyruvate. Step 2: The hydroxyethyl group is oxidized. Step 3: The enzyme-bound acetyl group is transferred to CoA.,"A carboxyl group is removed from pyruvate, releasing a molecule of carbon dioxide into the surrounding medium", "The hydroxyethyl group is oxidized to an acetyl group, and the electrons are picked up by NAD+", "The enzyme-bound acetyl group is transferred to CoA, producing a molecule of acetyl CoA", "This reaction creates a two-carbon hydroxyethyl group bound to the enzyme (pyruvate dehydrogenase)"
57,What is the final electron acceptor in the electron transport chain during aerobic respiration?,"molecular oxygen","carbon dioxide","water","glucose","molecular oxygen"
58,What is the purpose of lactic acid fermentation in animals and certain bacteria?,"to produce ATP in the absence of oxygen","to convert pyruvic acid into ethanol","to regenerate NAD+ from NADH","to remove lactic acid buildup","to regenerate NAD+ from NADH"
59,How is cholesterol connected to the glucose pathway?,"contributes to cell membrane flexibility and is a precursor of steroid hormones","made from the bonding of glycerol and three fatty acids","synthesis starts with acetyl groups and proceeds in only one direction","contributes to cell membrane flexibility and is a precursor of steroid hormones"
60,What enzyme is regulated by high levels of ATP, citrate, or a lower pH in glycolysis?,"phosphofructokinase", "pyruvate kinase", "pyruvate dehydrogenase", "isocitrate dehydrogenase","phosphofructokinase"
61,What compound receives electrons from NADH?,"FMN","ubiquinone","cytochrome c1","oxygen","ubiquinone"
62,What are the two main structures involved in photosynthesis and what are their functions?,"leaves, where photosynthesis generally takes place in the mesophyll, and chloroplasts, in which photosynthesis occurs internally", "stomata, which regulate gas exchange and water balance in leaves, and thylakoids, disc-shaped structures containing chlorophyll responsible for absorbing light","heterotrophs and photoautotrophs","the significance of sunlight for photosynthesis","leaves, where photosynthesis generally takes place in the mesophyll, and chloroplasts, in which photosynthesis occurs internally"
63,How can light energy be used to make food?,"Light energy is converted into chemical energy, which photoautotrophs use to build basic carbohydrate molecules","Explain how plants absorb energy from sunlight","Describe short and long wavelengths of light","Describe how and where photosynthesis takes place within a plant","Explain how plants absorb energy from sunlight"
64,What instrument can scientists use to determine the types of pigments present in a photosynthetic organism?,a spectrophotometer,chromatography,high-pressure liquid chromatography (HPLC),gas chromatography-mass spectrometry (GC-MS),a spectrophotometer
65,Which of the following statements is true?,In photosynthesis, oxygen, carbon dioxide, ATP, and NADPH are reactants. G3P and water are products.,In photosynthesis, chlorophyll, water, and carbon dioxide are reactants. G3P and oxygen are products.,In photosynthesis, water, carbon dioxide, ATP, and NADPH are reactants. RuBP and oxygen are products.,In photosynthesis, water and carbon dioxide are reactants. G3P and oxygen are products.,In photosynthesis, chlorophyll, water, and carbon dioxide are reactants. G3P and oxygen are products.
66,Which pigment molecule is capable of absorbing certain wavelengths of light and reflecting others?,"chlorophyll","carotenoid","chlorophyll b","chlorophyll a","carotenoid"
67,Which form of chemical signaling acts on nearby cells?,"autocrine signaling","endocrine signaling","paracrine signaling","direct signaling",paracrine signaling
68,How do paracrine signals differ from endocrine signals?,"have a short-lasting effect and elicit quick responses,have a 
long-lasting effect and produce a slower response","move by diffusion through the extracellular matrix, travel via the bloodstream",
"reside in endocrine glands, move between distant cells","elicit quick responses that last only a short period of time, produce a 
slower response but have a longer-lasting effect",,"have a short-lasting effect and elicit quick responses,have a long-lasting 
effect and produce a slower response"
69,How does a virus recognize its host?,"by binding to cell-surface receptors on the host cell","by invading random cells in the host","by replicating its DNA in the host cell","by hiding from the host cell","by binding to cell-surface receptors on the host cell"
70,What are small hydrophobic ligands able to do in terms of diffusing through the plasma membrane?,"directly diffuse through the plasma membrane and interact with internal receptors","bind to carrier proteins in the bloodstream","interact with extracellular domain of cell-surface receptors","facilitate the formation of dimerized receptors"
71,What is the main phospholipid that plays a role in cellular signaling?,Phosphatidylcholine (PC), Phosphatidylethanolamine (PE), Phosphatidylserine (PS), Phosphatidylinositol (PI),Phosphatidylinositol (PI)
72,What advantage might biofilm production confer on the S. aureus inside the catheter?,"It enables the bacteria to coordinate the release of toxins that will attack the host",
"It allows the bacteria to communicate with each other to form complex colonies","It helps the bacteria to survive in the hospital environment","It helps the bacteria to survive in the hospital environment"
73,What was hypothesized to be needed to control the more sophisticated functions of development, differentiation, and cellular communication in multicellular organisms?,"p2 + 2pq + q2 = 1",a population with 12 homozygous recessive individuals (yy), 8 homozygous dominant individuals (YY), and 4 heterozygous individuals (Yy),a population in which the allele frequencies do not change over time,a population undergoing natural selection,phosphorylation of tyrosine residues
74,What process helps to initiate gene expression in cells in response to external stimuli?,"protein synthesis, a change in the cell’s metabolism, cell growth, or even cell death","enzymes that interact with DNA transcription factors","modification of proteins and inducing them to change location in the cell","storing energy as glycogen or fat, or making it available in form of glucose","enzymes that interact with DNA transcription factors"
75,What approach would best help prevent bacterial colonization of medical implants in treating biofilms on artificial joints?,Increase antibiotic dosing,Create implants with rougher surfaces,Vaccinate patients against all pathogenic bacteria,Inhibit quorum sensing,Inhibit quorum sensing
76,What is the purpose of the G1 phase of interphase in the cell cycle?,"to accumulate the building blocks of chromosomal DNA and proteins", "to prepare for DNA replication", "to accumulate sufficient energy reserves", "all of the above","all of the above"
77,Will the mitotic spindle extend between the centrosomes, pushing them farther apart as the microtubule fibers lengthen?,"yes","no","maybe","not sure","yes"
78,What is the purpose of the G1 checkpoint in the cell cycle?,"to determine whether all conditions are favorable for cell division to proceed",
"to ensure that all of the chromosomes have been replicated and that the replicated DNA is not damaged","to assess proper chromosome duplication",
"to determine whether all the sister chromatids are correctly attached to the spindle microtubules","to determine whether all conditions are favorable for cell division to proceed"
79,Why are proteins like Rb and p53 referred to as tumor suppressors?,"they prevent uncontrolled cell growth","they are 
negative regulators of the cell cycle","they halt the cell cycle and prevent the duplication of damaged chromosomes","they 
trigger apoptosis if damaged DNA cannot be repaired","they prevent uncontrolled cell growth"
80,What is the process by which prokaryotes, such as bacteria, produce daughter cells?,"binary fission","mitosis","meiosis","cytokinesis","binary fission"
81,What is the first level of DNA organization in a eukaryotic cell maintained by?,"cohesin","condensin","chromatin","histone","histone"
82,28. Compare and contrast a human somatic cell to a human
gamete.,"human somatic cell: diploid, 46 chromosomes, produced through mitosis, used for growth and repair", 
"human gamete: haploid, 23 chromosomes, produced through meiosis, used for sexual reproduction","-","-", 
"human somatic cell: diploid, 46 chromosomes, produced through mitosis, used for growth and repair"
83,Explain the difference between meiosis and mitosis?,"meiosis produces haploid cells from diploid cells","meiosis produces haploid cells from diploid cells",
"meiosis involves two rounds of nuclear division","mitosis produces genetically identical daughter cells","meiosis produces haploid cells from diploid cells"
