id,question,answer_0,answer_1,answer_2,answer_3,correct
172,What is the endosymbiotic theory and how does it explain the evolution of eukaryotes?,"Eukaryotes may have evolved from a symbiotic relationship between a host cell and an alpha-proteobacterium","Metabolism in prokaryotes","Chromosomes organized by histones","Ancestral interactions giving rise to eukaryotes", "Eukaryotes may have evolved from a symbiotic relationship between a host cell and an alpha-proteobacterium"
173,What is the major feature distinguishing prokaryotes from eukaryotes related to mitochondria?,"presence of mitochondria in virtually all eukaryotic cells, absence in prokaryotes",
"eukaryotic cells may contain one to several thousand mitochondria depending on energy consumption",
"mitochondria can no longer survive and reproduce outside the cell","all of the above","presence of mitochondria in virtually all eukaryotic cells, absence in prokaryotes"
174,What evidence suggests that chlorarachniophytes evolved from a secondary endosymbiosis event?,"data from Matt Russell","a sequential loss of a membrane during evolution","a vestigial nucleus in green algal endosymbiont","chromoplasts","a vestigial nucleus in green algal endosymbiont"
175,What is the significance of sexual reproduction in protists, and how does it relate to their ability to survive in changing environments?,"It allows protists to recombine genes and produce new variations of progeny, some of which may be better suited to surviving changes","It is often associated with resistant cysts that serve as a protective, resting stage","It may allow protists to wait out stressors until their environment becomes more favorable for survival","It is often associated with periods when nutrients are depleted or environmental changes occur","It allows protists to recombine genes and produce new variations of progeny, some of which may be better suited to surviving changes"
176,How do foraminiferans play a role in the nitrogen cycle?,"Foraminiferans exhibit porous shells built from various organic materials and typically hardened with calcium carbonate. The shells may house photosynthetic algae, which the forams can harvest for nutrition. Foram pseudopodia extend through the pores and allow the forams to move, feed, and gather additional building materials.",Foraminiferans are unicellular heterotrophic protists,Foraminiferans are associated with sand or other particles in marine or freshwater habitats,Foraminiferans are indicators of pollution and changes in global weather patterns,"Foraminiferans are the only eukaryotes known to participate in the nitrogen cycle by denitrification"
177,Which of the following organisms is a member of the stramenopiles supergroup?,"Diatoms","Plasmodium","Paramecium","Vampyrellids","Diatoms"
178,Which supergroup of protists includes heterotrophic predators, photosynthetic species, and parasites?,"Excavata","Amoebozoa","Archaeplastida","Rhizaria","Excavata"
179,What disease is caused by Trypanosoma brucei, a protist transmitted by tsetse flies in Africa and related flies in South America?,"malaria","African sleeping sickness","amoebic encephalitis","Chagas disease","African sleeping sickness"
180,What is the significance of the protist saprobes in returning inorganic nutrients to the soil and water, and how does this process support the growth of new plant life and sustain other organisms along the food chain?,"they allow for new plant growth, which generates sustenance for other organisms along the food chain","they help in recycling inorganic nutrients back into the environment","they break down dead organic matter and release nutrients into the soil and water","they play a crucial role in maintaining the balance of ecosystems", "they break down dead organic matter and release nutrients into the soil and water"
181,Which molecule is found in the cell walls of fungi and in the exoskeletons of arthropods?
a. Chitin
b. Melatonin
c. Keratin
d. Collagen
182,What are the necessary qualifications for someone to work as a mycologist?,a biological science (preferably majoring in microbiology) and a master's degree in mycology,a bachelor's degree in chemistry,"expertise in plant pathology",a degree in biochemistry,a biological science (preferably majoring in microbiology) and a master's degree in mycology
183,How do fungi reproduce asexually?,"by fragmentation, budding, or producing spores","producing spores directly from the tip or side of the hypha","forming single cells that are released as spores through fragmentation of a hypha","budding off the vegetative parent cell","by fragmentation, budding, or producing spores"
184,Which of the following statements is true?,"A dikaryotic ascus that forms in the ascocarp undergoes karyogamy, meiosis, and mitosis to form eight ascospores",
"A diploid ascus that forms in the ascocarp undergoes karyogamy, meiosis, and mitosis to form eight ascospores",
"A haploid zygote that forms in the ascocarp undergoes karyogamy, meiosis, and mitosis to form eight ascospores",
"A dikaryotic ascus that forms in the ascocarp undergoes plasmogamy, meiosis, and mitosis to form eight ascospores",
"A dikaryotic ascus that forms in the ascocarp undergoes karyogamy, meiosis, and mitosis to form eight ascospores"
185,What is the name of the phylum that comprises about 230 species involved in close associations with the roots of trees?,"Basidiomycota","Ascomycota","Zygomycota","Glomeromycota","Glomeromycota"
186,What are some common fungal pathogens that affect crops?,green mold on grapefruit, powdery mildew on a zinnia, stem rust on a sheaf of barley, grey rot on grapes,,powdery mildew on a zinnia
187,How are fungi important to human life?,"they are part of the nutrient cycle in ecosystems","they control the population of damaging pests","they help in the productivity of farm land","they are a part of the human diet","they are part of the nutrient cycle in ecosystems"
188,What is an example of a secondary metabolite of fungi that is of great commercial importance?,"Antibiotics such as penicillin and the cephalosporins","Fermented bread","CO2 and ethyl alcohol","Immunosuppressant drug cyclosporine","Antibiotics such as penicillin and the cephalosporins"
189,How do seedless plants differ from seed plants in their reproduction?,"They reproduce using spores instead of seeds","They require a moist environment for reproduction","They dominated the landscape during the Carboniferous period","They have not developed adaptations to survive in arid habitats","They reproduce using spores instead of seeds"
190,What characteristics do Chlorophytes and Charophytes share with land plants that other types of algae do not?,"they use chlorophyll a and b plus carotene in the same proportion as plants",
"they are absent from other types of algae","they both share common characteristics with land plants","they both use chlorophyll a and b in the same proportion as plants","they both share common characteristics with land plants"
191,What structures are observed on multicellular haploid gametophytes that give rise to gametes by mitosis in seedless plants?,"gametangia", "antheridium", "archegonium", "embryo","gametangia"
192,Which of the following statements about green algae and land plants is false?,
All green algae are multicellular beings,
Green algae and land plants store carbohydrates as starch,
Only land plants have plasmodesmata for transfer of materials between cells,
Green algae and land plants have different types of chlorophyll molecules,Green algae and land plants have different types of chlorophyll molecules
193,What are the defining characteristics of liverworts, hornworts, and mosses?,"Liverworts (Marchantiophyta) form a flat thallus with lobes, Hornworts (Anthocerotophyta) have a narrow, pipe-like sporophyte, Mosses (Bryophyta) are true Bryophyta",
"Bryophytes lack lignin and tracheids","By the end of the Silurian period, vascular plants had spread through continents","Liverworts are the plants most closely related to the ancestor of vascular plants","Liverworts (Marchantiophyta) form a flat thallus with lobes"
194,Which of the following statements about mosses is false?
a. Mosses slow down erosion
b. Mosses have stomata only on the sporophyte
c. Mosses form diminutive sporophytes
d. Mosses use lignin-reinforced conducting cells for support
195,What group of plants are known to have microphylls, megaphylls, and sporophylls?,"lycophytes, horsetails, and ferns","seedless vascular plants, pine cones, and ferns","club mosses, giant trees, and whisk ferns","horsetails, shrubs, and spike mosses","lycophytes, horsetails, and ferns"
196,Which of the following statements about the fern life cycle is false?,"Sporangia produce haploid spores.","The sporophyte grows from a gametophyte.","The sporophyte is diploid and the gametophyte is haploid.","Sporangia form on the underside of the gametophyte.",The sporangia produce haploid spores.
197,What characteristic of Charales would enable them to survive a dry spell?,"sperm with flagella","phragmoplasts","sporopollenin","chlorophyll a","sporopollenin"
198,What adaptations are present in seed plants that allowed them to reproduce without relying on water?,"protection of sperm within pollen grains, nourishment and protection of embryo within seeds","reliance on water for fertilization and reproduction","production of spores in male and female gametophytes","development of flagellated sperm within female gametophyte","protection of sperm within pollen grains, nourishment and protection of embryo within seeds"
199,When did gymnosperms first appear during the lower Jurassic period?,"about 240 million years ago","about 390 million years ago","about 125 million years ago","about 100 million years ago","about 240 million years ago"
200,What is the name of the group of gymnosperms that produce true xylem tissue and vessels, considered the closest group to angiosperms?,"Coniferophyta","Cycadophyta","Ginkgophyta","Gnetophyta","Gnetophyta"
201,What is the main reason for the success of angiosperms in dominating terrestrial ecosystems?,"They have evolved to dominate most terrestrial ecosystems with more than 300,000 species","They produce flowers and fruits for reproduction","Their colors and patterns attract specific pollinating insects or animals","Their fruit structures and dispersal strategies help spread seeds","They produce flowers and fruits for reproduction"
202,What type of gamete would not form if a flower lacked a megasporangium?,"male gamete - pollen grain","female gamete - egg","female gamete - embryo sac","male gamete - generative cell","female gamete - egg"
203,What are some characteristics shared by plants in the monocot group?,"presence of a single cotyledon in the seedling, veins that run parallel to and along the length of the leaves, flower parts arranged in a three- or six-fold symmetry, true woody tissue is rarely found"
204,Will flowers that offer cues to bees attract carrion flies if sprayed with compounds that smell like rotten flesh?,"flowers that attract carrion flies due to putrid smell similar to decaying flesh","flowers that attract bees","flowers sprayed with compounds that smell like fresh fruit","flowers undergoing natural selection","flowers that attract carrion flies due to putrid smell similar to decaying flesh"
205,How do heirloom seeds contribute to the preservation of biodiversity?,"they come from plants traditionally grown in human populations","they have not been used in modern agriculture on a large scale","they help preserve genetic diversity","they protect the ecosystem","they come from plants traditionally grown in human populations"
206,Which kingdom do animals belong to and what distinguishes them from organisms in other kingdoms?,"Domain Eukaryota, they are heterotrophic and ingest other living or dead organisms","they are autotrophic and synthesize their own nutrients through photosynthesis","they are unicellular and possess a single posterior flagellum","they have an alternation of generations","Domain Eukaryota, they are heterotrophic and ingest other living or dead organisms"
207,What is the significance of nerve tissues and muscle tissues in animals?,"to rapidly sense and respond to changes in their environment", "to support movement and coordination", "to allow for intercellular communication", "to survive in competitive environments", "to rapidly sense and respond to changes in their environment"
208,Which class of animals exhibits radially or biradially symmetry?,"Ctenophores" ,"Butterflies", "Sponges", "Placozoans", "Ctenophores"
209,Which animals display modified radial symmetry as adults and initially exhibit bilateral symmetry in their larval stages?,"animals in the phylum Echinodermata (such as sea stars, sand dollars, and sea urchins)",
"animals in the phylum Platyhelminthes (flatworms)",
"animals in the phylum Nematoda (roundworms)",
"animals in the phylum Arthropoda",
"animals in the phylum Echinodermata (such as sea stars, sand dollars, and sea urchins)"
210,What distinguishes Protostomes from Deuterostomes in terms of mouth development and coelom formation?,"Mouth develops at the blastopore in Protostomes, while mouth develops at the other end of the gut in Deuterostomes","Protostomes form coelom through schizocoely, while Deuterostomes form coelom through enterocoely","Protostomes undergo spiral cleavage, while Deuterostomes undergo radial cleavage","Protostomes have determinate cleavage, while Deuterostomes have indeterminate cleavage","Protostomes form coelom through schizocoely, while Deuterostomes form coelom through enterocoely"
211,When did the Cambrian period occur in the evolutionary history of the animal kingdom?,"635 million years ago","543 million years ago","530 million years ago","560 million years ago","543 million years ago"
212,What is the name of the arthropod-like creature that may have been a top predator during the Cambrian period?,Anomalocaris,Limulus,Trilobite,Crustacean,Anomalocaris
213,Which event in the evolutionary history of the animal kingdom is characterized by a very cold global climate?,presence of a coelom affords many advantages,Cryogenian period,animals with a body cavity completely lined with mesodermal tissue,Protostomes and Deuterostomes,Cryogenian period
214,Which of the following is a characteristic of sponges?,"They have specialized cells that perform specific functions like tissues","They do not possess a defined bony vertebral endoskeleton or a bony cranium","They create a true gastrula during embryogenesis","They produce tiny skeletal ""bones"" called ossicles"
215,Which of the following statements is false?,Choanocytes have flagella that propel water through the body.,Pinacocytes can transform into any cell type.,Lophocytes secrete collagen.,Porocytes control the flow of water through pores in the sponge body.,Lophocytes secrete collagen.
216,What is the defining cell type for cnidarians, located around the mouth and on the tentacles, and serves to capture prey or repel predators?,"choanocyte","cnidocyte","nematocyst","gastrozooid","cnidocyte"
217,What is the structure of the gastrovascular cavity in cnidarians?,"one opening serving as both a mouth and an anus; incomplete digestive system; extracellular and intracellular digestion; distribution of nutrients and gases",
"a circulatory system to move dissolved gases around the body","an excretory system to remove nitrogenous wastes","a complex network of organs to assist in digestion and circulation","one opening serving as both a mouth and an anus; incomplete digestive system; extracellular and intracellular digestion; distribution of nutrients and gases"
218,What is a defining characteristic shared by animals belonging to superphylum Lophotrochozoa?,"they possess an embryonic mesoderm sandwiched between the ectoderm and endoderm","they do not possess a lophophore or trochophore larvae","they have a concentration of nervous tissues and sensory organs in the head","they are triploblastic","they possess an embryonic mesoderm sandwiched between the ectoderm and endoderm"
219,What are the three embryonic tissue layers of flatworms and what tissues do they give rise to?,"ectoderm 
(epidermal tissues), endoderm (lining of the digestive system), mesoderm (other internal tissues)","an intestine with complete 
digestive system","two layers of muscle","mesodermal tissues include mesenchymal cells that contain collagen and support secretory 
cells", "ectoderm (epidermal tissues)"
220,What are some characteristics of the phylum Rotifera?,"mostly aquatic animals that get their name from the corona—a pair of ciliated feeding structures",
"divided into three sections: a head, a trunk, and a foot","typically free-swimming or planktonic organisms",
" have both skeletal muscle associated with locomotion and visceral muscles associated with the gut","A cuticle, rigid in some species and flexible in others"
221,Which of the following classes of mollusks is known as "bearing many plates"?,"Caudofoveata","Solenogastres","Monoplacophora","Polyplacophora","Polyplacophora"
222,What is one key characteristic of bivalves in terms of their body structure?,"They are enclosed in two-part valves or shells fused on the dorsal side by hinge ligaments as well as shell teeth on the ventral side","They have a well-defined head with tentacles and eyes","They have a foot that is wedge-shaped","They possess the unique ability to secrete and deposit a calcareous nacre or “mother of pearl” around foreign particles","They are enclosed in two-part valves or shells fused on the dorsal side by hinge ligaments as well as shell teeth on the ventral side"
223,What are some examples of shell-bearing cephalopods, and how do they regulate buoyancy in the water?,Cuttlefish, nautiluses, and squids,They regulate buoyancy by filling chambers with gas or water,They regulate buoyancy using a siphuncle that runs through the chambers,They use a spiral multi-chambered shell filled with gases or water to regulate buoyancy,They regulate buoyancy by filling chambers with gas or water
224,What is the typical mode of fertilization in polychaetes and oligochaetes?,"external fertilization including trochophore larva in polychaetes, and internal fertilization with cocoon production in oligochaetes","internal fertilization in polychaetes and external fertilization with trochophore larva in oligochaetes","simultaneous mutual fertilization in polychaetes and external fertilization with trochophore larva in oligochaetes","external fertilization including trochophore larva in polychaetes, and internal fertilization with cocoon production in oligochaetes","external fertilization including trochophore larva in polychaetes, and internal fertilization with cocoon production in oligochaetes"
225,How does Caenorhabditis elegans facilitate research in developmental studies and genetics?,"it is a mostly monoecious species with both self-fertilizing hermaphrodites and some males","it can be readily cultured on agar plates","it has a short life cycle of three days for egg to adult to daughter egg development","it contains about 1,000 cells and a genome of only 20,000 genes","every cell can be visualized and identified",it has a short life cycle of three days for egg to adult to daughter egg development
226,What is a characteristic feature of the arthropods in Phylum Arthropoda?,presence of jointed appendages,structural and functional segmentation,exoskeleton made of chitin,themolting process,exoskeleton made of chitin
227,What is the characteristic morphology of animals in Subphylum Chelicerata?,"a distinct ""head"" tagma is not usually discernible, the body is divided into prosoma and opisthosoma, chelicerae serve as specialized mouthparts, antennae are secondarily lost","chelicerae are actually modified legs, pedipalps are used for sensing the environment, some species have ovigers for grooming, spiders' chelicerae are modified into fangs","chelicerates have a brain and two ventral nerve cords, they are usually dioecious, some species use internal fertilization strategies","chelicerates are predominantly terrestrial, some species exist in freshwater and marine habitats","a distinct ""head"" tagma is not usually discernible, the body is divided into prosoma and opisthosoma, chelicerae serve as specialized mouthparts"
228,Which of the following statements about insects is false?,"Insects have both dorsal and ventral blood vessels","Insects have spiracles, openings that allow air to enter into the tracheal system","The trachea is part of the digestive system","Most insects have a well-developed digestive system with a mouth, crop, and intestine.","The trachea is part of the digestive system"
229,What is the defining characteristic of echinoderms?,"They exhibit pentaradial symmetry with arms typically arrayed in multiples of five around a central axis","They have an endoskeleton made of calcareous ossicles covered by the epidermis","They have a nervous system comprising a circumoral nerve ring and five radial nerves","They have a unique ambulacral (water vascular) system","They have a unique ambulacral (water vascular) system"
230,What are the key features shared by animals in the phylum Chordata?,"a notochord, a dorsal hollow nerve cord, pharyngeal slits, a post-anal tail, and an endostyle/thyroid gland that secretes iodinated hormones","most tunicates live on the ocean floor and are suspension feeders","Lancelets are suspension feeders that feed on phytoplankton and other microorganisms","in some groups, some of these traits are present only during embryonic development","a notochord, a dorsal hollow nerve cord, pharyngeal slits, a post-anal tail"
231,Which of the following statements is false about insects?,Insects have both dorsal and ventral blood vessels.,Insects have spiracles, openings that allow air to enter into the tracheal system.,The trachea is part of the digestive system.,Most insects have a well-developed digestive system with a mouth, crop, and intestine.,The trachea is part of the digestive system.
232,What are the two major innovations in evolution of vertebrates from invertebrate chordates?,"emergence of quadrupeds in the form of amphibians,evolution of the amniotic egg"
233,What are the five key characteristics shared by animals in the phylum Chordata?,"a notochord, a dorsal hollow (tubular) nerve cord, pharyngeal gill arches or slits, a post-anal tail, and an endostyle/thyroid gland","Only the notochord and nerve cord","Pharyngeal slits and a notochord","A notochord, a ventral nerve cord, pharyngeal arches, no post-anal tail, endostyle","Incorrect, a notochord is not a characteristic"
234,What is the defining feature of the living jawless fishes?,lack of jaws and lack of paired lateral appendages (fins),internal ossification and scales,paired fins,backbone,none of the above
235,What distinguishes rays and skates from sharks in terms of their physical characteristics?,"flattened bodies, enlarged and fused pectoral fins, and gill slits on their ventral surface","exposed gill slits and a heterocercal caudal tail","scales and teeth modified as grinding plates","diphycercal tail and pectoral and pelvic fins", "flattened bodies, enlarged and fused pectoral fins, and gill slits on their ventral surface"
236,What are the three clades of modern amphibians?,Urodela ("tailed"), Anura ("tail-less"), Apoda ("legless ones"), Lissamphibia
237,Which group of amphibians have no limbs but do have teeth in both jaws resembling earthworms?,"An estimated 185 species of caecilians", "Frogs", "Salamanders","Anura: Frogs","An estimated 185 species of caecilians"
238,Why do reptiles lay calcareous or leathery eggs enclosed in shells on land?,to reduce water loss from the skin,to protect the developing embryo,to allow for gas exchange,to provide nutrients for the growing embryo,"to reduce water loss from the skin"
239,Which group of reptiles includes approximately 9200 species?,"Crocodilia","Sphenodontia","Squamata","Testudines","Squamata"
240,Which reptilian group has the ability to move quickly on land through a galloping motion?,"Squamata","Crocodilia","Sphenodontia","Testudines","Crocodilia"
241,What is a key characteristic of bird feathers that helps in insulation and prevention of heat loss?,down feathers provide insulation,contour feathers create aerodynamic surface,feathers are asymmetrical and curved,feathers have microscopic branches called barbules linked together by hooks,down feathers provide insulation
242,What are some unique characteristics of birds compared to other vertebrates?,"elongate S-shaped neck, short tail or pygostyle, one occipital condyle, thin epidermis without sweat glands, uropygial gland for preening",
"closed circulatory system with two atria and two ventricles, right-bending aortic arch, nucleated red blood cells","12 pairs of cranial nerves, very large cerebellum and optic lobes, single bone in middle ear called the columella","a group of diapsids called the archosaurs",
"elongate S-shaped neck, thin epidermis without sweat glands, uropygial gland for preening"
243,What are some characteristics that distinguish mammals from other vertebrates?,hair, possess hair and mammary glands, three clades: monotremes, marsupials, and eutherians, hair,	mammary glands,mammary glands
244,What characteristic distinguishes synapsids, including mammals, from other vertebrates in terms of temperature regulation,"endothermy, rather than ectothermy","presence of a secondary palate","possession of heterodont teeth","absence of a procoracoid bone","endothermy, rather than ectothermy"
